{
  "schema_version": "1.1.0",
  "demo_id": "ave-demo-003-gated-pulse-contrast",
  "title": "Gated Pulse: 12 Hz at 25% Duty Cycle",
  "purpose": "Demonstrate explicit periodic on/off gating and duty cycle, distinct from a continuously varying smooth-AM envelope.",
  "duration_seconds": 12,
  "sample_rate_hz": 44100,
  "fps": 60,
  "audio": {
    "stages": [
      {
        "stage_id": "gated-pulse",
        "start_seconds": 0,
        "end_seconds": 12,
        "kind": "gated_pulse",
        "carrier_hz": 440,
        "rate": {
          "kind": "constant",
          "value_hz": 12
        },
        "duty_cycle": 0.25,
        "amplitude": 0.7,
        "edge_shape": "hard",
        "phase_origin_cycles": 0
      }
    ],
    "peak_linear": 0.8,
    "master_fade_seconds": 0.1,
    "stage_fade_seconds": 0
  },
  "visual": {
    "kind": "explanatory",
    "width": 960,
    "height": 540,
    "cards": [
      "title",
      "construction",
      "live",
      "verification",
      "boundary",
      "provenance"
    ]
  },
  "verification": {
    "evidence_maturity": "exploratory",
    "supported_claims": [],
    "unsupported_claims": [
      "Independent pulse-rate, duty-cycle, edge-shape, regularity, and stereo agreement has not yet been attached."
    ],
    "required_fields": [
      "input_sha256",
      "carrier_hz",
      "pulse_rate_hz",
      "duty_cycle",
      "edge_shape",
      "regularity",
      "stereo_relationship"
    ],
    "tolerances": {
      "carrier_hz": 0.5,
      "pulse_rate_hz": 0.25,
      "duty_cycle": 0.02,
      "regularity": 0.02
    }
  },
  "safety": {
    "calibrated_spl": false,
    "calibrated_luminance": false,
    "human_exposure_approved": false,
    "headphones_assumption": "Headphones are optional; both channels contain the same gated signal.",
    "warning": "Hard audio gates create abrupt transients. Engineering demonstration only; start at low playback level."
  },
  "distribution": {
    "media_origin": "original_synthetic",
    "redistributable": true,
    "license_note": "All audio and graphics are generated by AVE Generator from this tracked recipe."
  },
  "limitations": [
    "Hard gating is intentionally discontinuous and may sound harsh.",
    "Signal presence does not establish neural entrainment, mental-state change, therapy, or safety."
  ],
  "demo_version": "1.0.0"
}
