{
  "schema_version": "1.1.0",
  "demo_id": "ave-demo-001-binaural-construction",
  "title": "Binaural Construction: 10 Hz Difference",
  "purpose": "Demonstrate that separate left and right carriers create a measurable 10 Hz interaural frequency difference.",
  "duration_seconds": 12,
  "sample_rate_hz": 44100,
  "fps": 60,
  "audio": {
    "stages": [
      {
        "stage_id": "binaural-10hz",
        "start_seconds": 0,
        "end_seconds": 12,
        "kind": "binaural",
        "left_hz": 440,
        "right_hz": 450,
        "amplitude": 0.7,
        "phase_origin_cycles": 0
      }
    ],
    "peak_linear": 0.8,
    "master_fade_seconds": 0.1,
    "stage_fade_seconds": 0
  },
  "visual": {
    "kind": "explanatory",
    "width": 960,
    "height": 540,
    "cards": [
      "title",
      "construction",
      "live",
      "verification",
      "boundary",
      "provenance"
    ]
  },
  "verification": {
    "evidence_maturity": "exploratory",
    "supported_claims": [],
    "unsupported_claims": [
      "Independent field-level Forensics agreement has not yet been attached to this package."
    ],
    "required_fields": [
      "input_sha256",
      "duration_seconds",
      "left_carrier_hz",
      "right_carrier_hz",
      "difference_hz",
      "channel_routing",
      "sample_peak_linear"
    ],
    "tolerances": {
      "duration_seconds": 0.001,
      "carrier_hz": 0.5,
      "difference_hz": 0.25,
      "sample_peak_linear": 0.0001
    }
  },
  "safety": {
    "calibrated_spl": false,
    "calibrated_luminance": false,
    "human_exposure_approved": false,
    "headphones_assumption": "Stereo headphones are required to preserve separate left and right carriers.",
    "warning": "Engineering demonstration only. Start at low playback level; digital amplitude is not calibrated SPL."
  },
  "distribution": {
    "media_origin": "original_synthetic",
    "redistributable": true,
    "license_note": "All audio and graphics are generated by AVE Generator from this tracked recipe."
  },
  "limitations": [
    "A 10 Hz interaural difference does not establish perception, neural entrainment, mental-state change, therapeutic benefit, or exposure safety."
  ],
  "demo_version": "1.0.0"
}
