{
  "schema_version": "1.1.0",
  "demo_id": "ave-demo-005-staged-av-comparison",
  "title": "Staged Comparison: Binaural, Smooth AM, and Gated Pulse",
  "purpose": "Present three separately labeled constructions on one monotonic timeline without conflating interaural difference, continuous modulation, and explicit gating.",
  "duration_seconds": 15,
  "sample_rate_hz": 44100,
  "fps": 60,
  "audio": {
    "stages": [
      {
        "stage_id": "binaural",
        "start_seconds": 0,
        "end_seconds": 5,
        "kind": "binaural",
        "left_hz": 440,
        "right_hz": 450,
        "amplitude": 0.7,
        "phase_origin_cycles": 0
      },
      {
        "stage_id": "smooth-am",
        "start_seconds": 5,
        "end_seconds": 10,
        "kind": "smooth_am",
        "carrier_hz": 440,
        "rate": {
          "kind": "constant",
          "value_hz": 10
        },
        "depth": 1,
        "amplitude": 0.7,
        "envelope_shape": "sine",
        "phase_origin_cycles": 0
      },
      {
        "stage_id": "gated-pulse",
        "start_seconds": 10,
        "end_seconds": 15,
        "kind": "gated_pulse",
        "carrier_hz": 440,
        "rate": {
          "kind": "constant",
          "value_hz": 10
        },
        "duty_cycle": 0.25,
        "amplitude": 0.7,
        "edge_shape": "hard",
        "phase_origin_cycles": 0
      }
    ],
    "peak_linear": 0.8,
    "master_fade_seconds": 0.1,
    "stage_fade_seconds": 0.02
  },
  "visual": {
    "kind": "explanatory",
    "width": 960,
    "height": 540,
    "cards": [
      "title",
      "construction",
      "live",
      "verification",
      "boundary",
      "provenance"
    ]
  },
  "verification": {
    "evidence_maturity": "exploratory",
    "supported_claims": [],
    "unsupported_claims": [
      "Independent per-stage field agreement and transition-boundary coverage have not yet been attached."
    ],
    "required_fields": [
      "input_sha256",
      "stage_bounds",
      "transition_bounds",
      "channel_routing",
      "binaural_difference_hz",
      "smooth_am_rate_hz",
      "gated_pulse_rate_hz",
      "duty_cycle",
      "edge_shape"
    ],
    "tolerances": {
      "stage_bounds_seconds": 0.001,
      "carrier_hz": 0.5,
      "rate_hz": 0.25,
      "duty_cycle": 0.02
    }
  },
  "safety": {
    "calibrated_spl": false,
    "calibrated_luminance": false,
    "human_exposure_approved": false,
    "headphones_assumption": "Stereo headphones are required for the binaural stage and optional for the shared stages.",
    "warning": "Engineering comparison only. Start at low playback level; hard gates create abrupt transients."
  },
  "distribution": {
    "media_origin": "original_synthetic",
    "redistributable": true,
    "license_note": "All audio and graphics are generated by AVE Generator from this tracked recipe."
  },
  "limitations": [
    "The three stages demonstrate engineering differences, not relative efficacy or subjective outcome.",
    "No neurological, therapeutic, clinical, or general exposure-safety claim is made."
  ],
  "demo_version": "1.0.0"
}
