{
  "schema_version": "1.1.0",
  "demo_id": "ave-demo-004-four-region-light",
  "title": "Four-Region Deterministic Light Schedules",
  "purpose": "Demonstrate four independently addressable visual regions with explicit off intervals and deterministic frame quantization.",
  "duration_seconds": 4,
  "sample_rate_hz": 44100,
  "fps": 60,
  "audio": {
    "stages": [
      {
        "stage_id": "silence",
        "start_seconds": 0,
        "end_seconds": 4,
        "kind": "silence"
      }
    ],
    "peak_linear": 0.8,
    "master_fade_seconds": 0,
    "stage_fade_seconds": 0
  },
  "visual": {
    "kind": "four_region",
    "width": 960,
    "height": 540,
    "light_recipe_path": "contracts/examples/synthetic-four-region-recipe.json",
    "light_recipe_sha256": "f46618b06b7dbc782f6e65529e74c41641533d7fb03dca1a227b43b61faae43f"
  },
  "verification": {
    "evidence_maturity": "exploratory",
    "supported_claims": [],
    "unsupported_claims": [
      "Independent field-level pixel-plan agreement has not yet been attached; no physical luminance or device-equivalence evidence exists."
    ],
    "required_fields": [
      "recipe_sha256",
      "resolved_plan_sha256",
      "region_independence",
      "off_intervals",
      "frame_count",
      "refresh_hz",
      "quantization_error_us"
    ],
    "tolerances": {
      "frame_count": 0,
      "quantization_error_us": 8333.334
    }
  },
  "safety": {
    "calibrated_spl": false,
    "calibrated_luminance": false,
    "human_exposure_approved": false,
    "headphones_assumption": "No audio stimulus is present.",
    "warning": "Offline flashing-light engineering preview. Not calibrated or approved for human exposure."
  },
  "distribution": {
    "media_origin": "original_synthetic",
    "redistributable": true,
    "license_note": "All graphics are generated by AVE Generator from tracked synthetic recipes."
  },
  "limitations": [
    "Software RGB intensity is not calibrated luminance.",
    "The emulator is not evidence of Lumenate Nova equivalence, packet-to-photon latency, or subframe emitter phase."
  ],
  "demo_version": "1.0.0"
}
