{
  "schema_version": "1.1.0",
  "demo_id": "ave-demo-002-smooth-am-ramp",
  "title": "Smooth Amplitude-Modulation Ramp: 4 to 20 Hz",
  "purpose": "Demonstrate a continuous sinusoidal amplitude envelope whose rate increases linearly from 4 to 20 Hz.",
  "duration_seconds": 12,
  "sample_rate_hz": 44100,
  "fps": 60,
  "audio": {
    "stages": [
      {
        "stage_id": "smooth-am-ramp",
        "start_seconds": 0,
        "end_seconds": 12,
        "kind": "smooth_am",
        "carrier_hz": 440,
        "rate": {
          "kind": "linear",
          "start_hz": 4,
          "end_hz": 20
        },
        "depth": 1,
        "amplitude": 0.7,
        "envelope_shape": "sine",
        "phase_origin_cycles": 0
      }
    ],
    "peak_linear": 0.8,
    "master_fade_seconds": 0.1,
    "stage_fade_seconds": 0
  },
  "visual": {
    "kind": "explanatory",
    "width": 960,
    "height": 540,
    "cards": [
      "title",
      "construction",
      "live",
      "verification",
      "boundary",
      "provenance"
    ]
  },
  "verification": {
    "evidence_maturity": "exploratory",
    "supported_claims": [],
    "unsupported_claims": [
      "Continuous modulation-ramp agreement awaits the independent Forensics ramp analyzer."
    ],
    "required_fields": [
      "input_sha256",
      "carrier_hz",
      "envelope_shape",
      "rate_start_hz",
      "rate_end_hz",
      "slope_hz_per_second",
      "coverage",
      "residual"
    ],
    "tolerances": {
      "carrier_hz": 0.5,
      "rate_hz": 0.5,
      "slope_hz_per_second": 0.1,
      "coverage": 0.05
    }
  },
  "safety": {
    "calibrated_spl": false,
    "calibrated_luminance": false,
    "human_exposure_approved": false,
    "headphones_assumption": "Headphones are optional; both channels contain the same smooth-AM signal.",
    "warning": "Engineering demonstration only. Start at low playback level; digital amplitude is not calibrated SPL."
  },
  "distribution": {
    "media_origin": "original_synthetic",
    "redistributable": true,
    "license_note": "All audio and graphics are generated by AVE Generator from this tracked recipe."
  },
  "limitations": [
    "This is smooth sinusoidal amplitude modulation with no hard on/off gate.",
    "Signal presence does not establish neural entrainment, mental-state change, therapy, or safety."
  ],
  "demo_version": "1.0.0"
}
